Name;Price;Sale;Info;Size;Type;Image
3PC SEXY CORSET SET;€49,90;;Burlesque strapless corset adorned with bow accents, hidden side hook and eye closure, lace-up back.  90% Polyester, 10% Spandex. Pink/Black.  Comes with matching thong, and matching skirt. ;S ;Lady Lingerie Sets;http://s1.postimg.org/46cfypodr/3_PC_SEXY_CORSET_SET_49_90.jpg
4-PIECE LEATHER DRESS & TIE;€29,90;;4-piece Leather Dress & Tie including: - collar, - tie, - leather dress, - handwear. It is very comfortable to touch and wear. Special and modern design makes you more attractive, charming, fashion and chic.;ONE;Lady Lingerie Sets;http://s1.postimg.org/w7qhcetnz/4_PIECE_LEATHER_DRESS_TIE_29_90.jpg
BASQUE SET S-L;€22,00;;Basque, string and matching stockings with stripes. Black. 100% polyamide.  ;ONE;Lady Lingerie Sets;http://s1.postimg.org/87y4i4627/BASQUE_SET_S_L_22_00.jpg
BELTED MINI SKIRT SETS;€24,90;€15,90;Cheetah belted mini skirt sets include top and skirt with belt. Material : Acrylic+ Spandex. one size. ;ONE;Lady Lingerie Sets;http://s1.postimg.org/lddmo7zxr/BELTED_MINI_SKIRT_SETS_24_90.jpg
BIKINI SET;€35,90;;Datex is brand new material made of natural caoutchouc and very extensible knitted fabric. Because of great extensibility and resistance, Datex is easy to put on. It will make you feel comfortable and ensures traditional latex quality at the same time. ;S|M ;Lady Lingerie Sets;http://s1.postimg.org/pijxwe8bz/BIKINI_SET_BLACK_25_90.jpg
BIKINI SET;€29,90;€25,90;Bikini set. ;S|M ;Lady Lingerie Sets;http://s1.postimg.org/k8jkiudgv/BIKINI_SET_LEOPARD_29_90.jpg
BIKINI SET;€24,90;;Set includes bra and low cut pants.   Material: swim fabric;S ;Lady Lingerie Sets;http://s1.postimg.org/9cs6nhsj3/BIKINI_SET_RED_29_90.jpg
BIKINI SET - BLACK;€25,90;€19,90;Bikini set. Material: Nylon + Spandex . Color: Black.;S|M|L ;Lady Lingerie Sets;http://s1.postimg.org/wfipmnu0f/BIKINI_SET_WHITE_25_90.jpg
BIKINI SET - LEOPARD;€29,90;€24,90;Bikini set. ;S ;Lady Lingerie Sets;http://s1.postimg.org/4j8fimw1b/BIKINI_SET_WHITE_28_90.jpg
BIKINI SET - RED;€29,90;€24,90;Set includes padded bra and low cut pants.   Material: swim fabric;S ;Lady Lingerie Sets;http://s1.postimg.org/h82q2b25r/BIKINI_SET_24_90.jpg
BIKINI SET - WHITE;€25,90;€19,90;Bikini set. Color: white. Material: Nylon + Spandex;S|M|L ;Lady Lingerie Sets;http://s1.postimg.org/7rcwvoib3/BIKINI_SET_29_90.jpg
BIKINI SET - WHITE;€28,90;€24,90;Fully lined. Bikini top with underwired & padded cups. Clip closure at the back and halter-neck ties.  Color: white . Material: Nylon + Spandex. ;S|M|L ;Lady Lingerie Sets;http://s1.postimg.org/junagczov/BIKINI_SET_35_90.jpg
"BIKINI SET ""ZIP-ZIP-ZIP""";€19,90;;Zip, Zip, Zip - Et Voilá! Soft elastic mesh bikini style combo with red zippers to quickly open for the bare necessities.  The bra ties in the neck and back, the g-string at the sides. Material: 100 % polyester.;ONE;Lady Lingerie Sets;http://s1.postimg.org/bl6d4tzn3/BIKINI_SET_ZIP_ZIP_ZIP_19_90.jpg
BIKINI SKIRT SET - GOLD;€9,99;;Bikini Skirt Set;ONE;Lady Lingerie Sets;http://s1.postimg.org/y3mwyfe7j/BIKINI_SKIRT_SET_GOLD_9_99.jpg
BLACK LEATHERETTE STITCHING VERSATILE SKIRT SET;€19,90;;Owning a set of all-match clubwear, you will get rid of a lot of much trouble. Look at this Leatherette Stitching Versatile Skirt Set. It is the one you are looking for. A bodycon mini skirt and crop top designed with individual neck, which vary from front to back. This set can be dressed reversely, it can well show your sexy charm and implicit beauty. Meanwhile, both the top and the skirt are half leatherette, you would love the cool feeling it brings.  Material : polyester+spandex.;ONE;Lady Lingerie Sets;http://s1.postimg.org/p5x53yffz/BLACK_LEATHERETTE_STITCHING_VERSATILE_SKIRT_SET.jpg
BLACK LEVEL - LACK BH, STRING UND STRAPS;€40,80;;;S ;Lady Lingerie Sets;http://s1.postimg.org/pwux6uo4v/BLACK_LEVEL_LACK_BH_STRING_UND_STRAPS_40_80.jpg
BLACK LEVEL - VINYL SET;€39,90;;Top and pleated mini skirt in a set. Purple chequers in combination with black vinyl and net. Top with adjustable straps and four buckles in the front. Mini skirt with a lateral zipper and a decorative vinyl belt with four snap hooks and one ring.  100% polyester with polyurethane-coating.;S|M ;Lady Lingerie Sets;http://s1.postimg.org/c70dy210v/BLACK_LEVEL_VINYL_SET_39_90.jpg
BLACK LEVEL VINÜÜL TOP JA SEELIK;€62,90;€19,90;Black Level Vinüül Top ja Seelik ;L ;Lady Lingerie Sets;http://s1.postimg.org/aqovfwy3z/BLACK_LEVEL_VIN_L_TOP_JA_SEELIK_62_90.jpg
BLACK OPEN CUPS BRA LACE LINGERIE SET;€12,90;;"Strike the balance between flirtatious and outrageous. Lace balconet shape under wire cupless bra with bow & bling details, adjustable shoulder straps, fasten by the hook n eye closure on back. The g-string is also adjustable for a perfect fit you want.  Features
•Smooth soft lace created, this bra set is sure to make you sexy and snug
•Enjoy the kind of being cherish feeling in this sexy lingerie
•Sexy lingerie to reduce, discard the outfit and fetch it out instead
•Precious lace makes this bra set more bewitching and dissolute";ONE;Lady Lingerie Sets;http://s1.postimg.org/j3ukakxbj/BLACK_OPEN_CUPS_BRA_LACE_LINGERIE_SET_12_90.jpg
BLACK TOP WITH SKIRT;€29,90;;Ultra feminine set. ;S/M 36-38;Lady Lingerie Sets;http://s1.postimg.org/3q0vn4wbz/BLACK_TOP_WITH_SKIRT_29_90.jpg
BLONDE BOMBSHELL SET, XXL/XXXL;€29,90;;Blonde Bombshell set: - Chemise, - G-Strings. Color: black. Material: 90% polyester, 10% elasthan.;XXL/XXXL;Lady Lingerie Sets;http://s1.postimg.org/iahyhyran/BLONDE_BOMBSHELL_SET_XXL_XXXL_29_90.jpg
BOARDING SCHOOL CUTIE UNIFORM;€69,90;;3 piece Boarding School Cutie Uniform: - Skirt, - Top, - Tie. Material: 70% Polyester, 15% Polyamide, 15% Elastane. ;XL|XXL|XXXL;Lady Lingerie Sets;http://s1.postimg.org/dd4dwupbj/BOARDING_SCHOOL_CUTIE_UNIFORM_69_90.jpg
BOARDROOM BABE PINSTRIPE CORSET SETS;€34,90;;Three pieces Strapless pinstripe corset. ;S|M|XL|XXL;Lady Lingerie Sets;http://s1.postimg.org/akb6ctoz3/BOARDROOM_BABE_PINSTRIPE_CORSET_SETS_34_90.jpg
BOLD GOLD PLEATED MINI SET;€28,90;;Yes, we do love shiny things! Sparkle all night in this sexy, shiny set.  Material: 93% Polyester / 7% Spandex.;ONE;Lady Lingerie Sets;http://s1.postimg.org/n1mfdq9in/BOLD_GOLD_PLEATED_MINI_SET_28_90.jpg
BRA AND GARTER BELT SET, BLACK;€39,90;;Bra and garter belt set . Color: black. decorated with silver ornaments.;S|M|L|XL;Lady Lingerie Sets;http://s1.postimg.org/9yqsugjan/BRA_AND_GARTER_BELT_SET_BLACK_39_90.jpg
BRA SET WITH OPEN CUPS;€24,90;;3pc set.  3pc bra set in beautiful red satin and black lace. The underwire bra features 1/4-cups in read satin overlaid with black lace. The bra also features a row of sparkling crystals along the top of the cups. Adjustable shoulder straps and closesin the back iwth adjustable hook and eye. The garter belt has an adjustable closure in the back and four adjustable garters. Comes with matching thong. Note! Stockings and nipple covers are not included.;ONE;Lady Lingerie Sets;http://s1.postimg.org/mfxghmegf/BRA_SET_WITH_OPEN_CUPS_24_90.jpg
BREATHTAKING CABIN STEWARDESS UNIFORM;€29,90;;Ready for a delightful flight! Breathtaking Cabin Stewardess Uniform includes a contrast panel corset with halter neck and mesh sides, black and white microskirt and matching waist belt. Your voyage is easeful and more appealing in this steal the show stewardess costume. ;M|L;Lady Lingerie Sets;http://s1.postimg.org/90afs65yn/BREATHTAKING_CABIN_STEWARDESS_UNIFORM_29_90.jpg
BURLESQUE CORSET SKIRT SET, RED;€36,90;;Burlesque Corset Skirt Set. The design of the corset creates a perfect classic burlesque look.  It is beautifully designed fashion corset with an open back with adjustable criss cross lacing and will hug any body shape and look gorgeous for any occasion.Materjal:Damask.;M|L;Lady Lingerie Sets;http://s1.postimg.org/v9ocyq1f3/BURLESQUE_CORSET_SKIRT_SET_RED_36_90.jpg
BUSTIER CORSET WITH GORGEOUS SKIRT;€39,90;;Bustier corset with gorgeous skirt . Color: Green.;S ;Lady Lingerie Sets;http://s1.postimg.org/kt88we2en/BUSTIER_CORSET_WITH_GORGEOUS_SKIRT_39_90.jpg
CHARMING CHAMBERMAID COSTUME;;;"Ultra sexy Chambermaid Costume. - Corset-Top
- clear straps
- Puffed skirt
- Arm bands
- Neck piece
- Head band
- Duster";ONE;Lady Lingerie Sets;http://s1.postimg.org/lg75lwzan/CHARMING_CHAMBERMAID_COSTUME_25_90.jpg
CHEEKY GIRL 3-PIECE SET,RED XXXL;€39,90;;Cheeky Girl 3-Piece Suspender Set:  - Quarter cup bra, - Suspender, - Thong. Color: red. Material: 90% polyamide 10% elasthan. ;XXXL;Lady Lingerie Sets;http://s1.postimg.org/j05c82h7z/CHEEKY_GIRL_3_PIECE_SET_RED_XXXL_39_90.jpg
CORSET + SKIRT WITH SILVER BRADS;€45,90;;Sexy corset and skirt with silver brads.. Material: Polyurethane 60%, 20% Polyester, 20% Elastane. Color: black.;S|M|L|XL;Lady Lingerie Sets;http://s1.postimg.org/os5gf7r1r/CORSET_SKIRT_WITH_SILVER_BRADS_45_90.jpg
CORSET WITH SKIRT AND STRING;€45,90;;Unique, very sexy set. Corset is a great idea not only to rock party, or dance night in the Club - with for example a white shirt will create a sharp-sweet blend of sex and class! You decide what you want: erotic, sexy style or everyday elegance! Skirt perfectly adapts to the body, tying intriguing attract the eye and stimulate the imagination ... you can be queen of the night!  black corset, skirt and sexy matching string.;S|M|XL ;Lady Lingerie Sets;http://s1.postimg.org/z4wcf19yn/CORSET_WITH_SKIRT_AND_STRING_45_90.jpg
COWGIRL KOMPLEKT (S);€31,30;€9,90;Materjal: 96% puuvill 4% elastaan ;S ;Lady Lingerie Sets;http://s1.postimg.org/5bpc6flbj/COWGIRL_KOMPLEKT_S_31_30.jpg
EROTIC OPEN BRA SET WITH SUSPENDERBELT S/M;€24,90;;In our new collection - an explosion of sensuality and eroticism! Surprise to your man! He will be delighted! Extremely sexy and provocative set !  bra uncover breast and the strings attached to a suspender belt. This exclusive Set is made of nice to touch material in small hearts,it is adorned with sweet ribbon. Delivered in glossy, bordo gift box.;S/M|L/XL;Lady Lingerie Sets;http://s1.postimg.org/gldgnn0z3/EROTIC_OPEN_BRA_SET_WITH_SUSPENDERBELT_S_M_24_90.jpg
EXTREMELY SEXY AND PROVOCATIVE SET, RED;€24,90;;Extremely sexy and provocative set ! bra uncover breast, suspender belt and string. This exclusive Set is made of beauty full material with exclusive lace . Delivered like all our products in glossy bordo gift box. ;S/M ;Lady Lingerie Sets;http://s1.postimg.org/ow3v97lwv/EXTREMELY_SEXY_AND_PROVOCATIVE_SET_RED_24_90.jpg
FASHION LACE CROSS TEE SKIRT SET;€28,90;;This Fashion Lace Cross Tee Skirt Set never gets out of date but always looking elegant anytime you wear it. It conforms to the standard of modern women’s curve lines and looks very flattering, tee top detailed with lace cross front and back adding endless feminine charm, it also have cut out view on back, complimentary skirt make a perfect combination. ;M|L;Lady Lingerie Sets;http://s1.postimg.org/x2vv0sbzj/FASHION_LACE_CROSS_TEE_SKIRT_SET_28_90.jpg
GOLD BIKINI SET;€12,95;;Sexy bra with mini dress. ;ONE;Lady Lingerie Sets;http://s1.postimg.org/7cfvr9hgv/GOLD_BIKINI_SET_12_95.jpg
"HALF-CUP SET ""LEA""";€26,90;;Neat set with satin and lace embellishment for tempting moments. Half-cup bra with padded cups. Straps and closure in the back are adjustable. Comes with matching suspender mini skirt with adjustable and detachable garter clips, ornamental lacing and two forming bones in the back. Colour: brown/black/rose. Shelf bra: 92% polyester, 8% elastane. Mini skirt: 50% polyamide, 40% polyester, 10% elastane. Without stockings. ;75B/S| 85B/L| 90B/XL;Lady Lingerie Sets;http://s1.postimg.org/s8262idnz/HALF_CUP_SET_LEA_26_90.jpg
LACE GARTER CHEMISE SET WITH G-STRING;€16,90;;Seduce in this sheer form fitting chemise with detachable garters, including a lace overlay in front, mesh panels around your curves with a hook and eye closure, a rhinestone ring accent, and matching g-string. Stockings not included.. Color: black. Material: Polüester +Spandex;ONE;Lady Lingerie Sets;http://s1.postimg.org/nwdkdi6r3/LACE_GARTER_CHEMISE_SET_WITH_G_STRING_16_90.jpg
LANANA;€28,90;;Breathtaking and irresistable with this demi-cup vinyl soft-leatherlook bra with underwire and mini-skirt with matching G-String you will be incredibly attractiv and the Vamp of the Night. ;Breast: 80-92 cm| Cups B-D| Waist: 55-75 cm| Hips: 82-94 cm ;Lady Lingerie Sets;http://s1.postimg.org/milxi77hr/LANANA_28_90.jpg
LEOPARD PRINT LONG SLEEVES SKIRT SET;€23,90;;Take a close look at this piece for this gorgeous and fun vintage flavor. This versatile design would also be great for a night on the town. It features all over leopard print, unique round neck, long sleeves and tight fitted. The leopard pattern in the fabric is striking, while the simple, elegant design makes this such a standout. Maybe you can also wear them separately and match with others perfectly. ;ONE;Lady Lingerie Sets;http://s1.postimg.org/61cpwjb8v/LEOPARDI_MUSTRIGA_KORSETT_ALUSP_KSTEGA_43_15.jpg
LEOPARDI MUSTRIGA KORSETT ALUSPÜKSTEGA;€43,15;€12,90;Leopardi mustriga korsett aluspükstega . Seksikas komplekt satiin- ja pitskaunistustega. ;M|L;Lady Lingerie Sets;http://s1.postimg.org/lwwym3cfj/LEOPARD_PRINT_LONG_SLEEVES_SKIRT_SET_23_90.jpg
LONG SLEEVED CROPPED TOP AND MINI SKIRT SET;€19,90;; Long Sleeved Cropped Top and Mini Skirt Set . Material : 100% Polüester. Long sleeve. Revealing crops.;M|L;Lady Lingerie Sets;http://s1.postimg.org/mnporvesv/LONG_SLEEVED_CROPPED_TOP_AND_MINI_SKIRT_SET_19_9.jpg
MARILYN SET S/M;€24,90;;Baby Doll in pink, a charming set slightly transparent decorated with cheeky frills. This astonishing Set simply twists every man in the head. SET INCLUDES: the bra, string and skirt.;S/M;Lady Lingerie Sets;http://s1.postimg.org/srbupiugf/MARILYN_SET_S_M_24_90.jpg
METAL MANIA TEDDY SET ONE SIZE;€49,90;;- Chain Teddy with Claw Clip Closure and O-ring . - Soft Knit Elastic G-string with Chain Details. - Vinyl Cuffs with Lace Trim and Chains.Material: 100% Metal alloy;ONE;Lady Lingerie Sets;http://s1.postimg.org/4ov0undtb/METAL_MANIA_TEDDY_SET_ONE_SIZE_49_90.jpg
ONE PIECE SWIMSUIT - PINK;€29,90;€14,90;One Piece Swimsuit . Color: pink. Material: Nylon+ Spandex. ;S|M|L ;Lady Lingerie Sets;http://s1.postimg.org/wrj01rkxb/ONE_PIECE_SWIMSUIT_PINK_29_90.jpg
RED CORNER TOP+ROCK CLUB, BLACK;€25,90;€19,90;95% Polyester, 5 % Elasthan.  ;XS;Lady Lingerie Sets;http://s1.postimg.org/t6n4ijgdr/RED_CORNER_TOP_ROCK_CLUB_BLACK_25_90.jpg
RED LINGERIE SET;€23,90;;Package includes Top, miniskirt and g-strings. Color: Red. ;ONE;Lady Lingerie Sets;http://s1.postimg.org/ayqahnd7z/RED_LINGERIE_SET_23_90.jpg
RED PANTHERA BRA SET;€29,90;;Open Bra, Garterbelt, a sexy String and the Hot Pants ( 4 pcs ) ;L/XL;Lady Lingerie Sets;http://s1.postimg.org/c8o3wp6zz/RED_PANTHERA_BRA_SET_29_90.jpg
RED TOP WITH SKIRT;€29,90;;Ultra feminine set. ;S/M 36-38;Lady Lingerie Sets;http://s1.postimg.org/rnwbraz73/RED_TOP_WITH_SKIRT_29_90.jpg
SCHOOLGIRL UNIFORM;€49,90;;3 piece sexy Schoolgirl uniform : - Skirt, - Top, - Tie. Color: red. Material: 100% Polyester. ;XL|XXL|XXXL;Lady Lingerie Sets;http://s1.postimg.org/er9sxdsq7/SCHOOLGIRL_UNIFORM_69_90.jpg
SEAMLESS SLITS HOTSHORT SET PINK;€35,90;;Open netting and plenty of slits let you show abudant skin in this skimpy set. One size fits most. ;ONE;Lady Lingerie Sets;http://s1.postimg.org/lx1jzu1tb/SEAMLESS_SLITS_HOTSHORT_SET_PINK_35_90.jpg
SECRETARY CORSET SKIRT OUTFIT;€37,90;;Secretary corset skirt outfit whit stripes . The pack includes: skirt and corset. Corset with front zipper closure, lace-up back. ;S|M|L ;Lady Lingerie Sets;http://s1.postimg.org/6n1osn6b3/SECRETARY_CORSET_SKIRT_OUTFIT_37_90.jpg
SEDUCTIVE CAPTAIN COSTUME;€24,90;;This costume includes studded bra top with fringe cords on shoulder straps and pull up star studded mini skirt with fringe trim. It’s definitely a sweet sensual dessert after dinner. Material: 100% Polyester;ONE;Lady Lingerie Sets;http://s1.postimg.org/ssqdwolnz/SEDUCTIVE_CAPTAIN_COSTUME_24_90.jpg
"SET ""CHIC""";€16,95;;Sexy two piece set is simply chic.  Pleated ruffle wetlook mini skirt is also included.;ONE;Lady Lingerie Sets;http://s1.postimg.org/rrq57k4of/SET_CHIC_16_95.jpg
"SET ""ELEGANT""";€14,95;;Tube top and mini skirt . Color: Black;ONE;Lady Lingerie Sets;http://s1.postimg.org/61lwo0q0f/SET_ELEGANT_14_95.jpg
"SET ""FEMININE""";€39,90;;¼ Cup Bra, Suspender Belt & String . Underwired ¼ cup bra with slightly padded cups and wide suspender belt.  Both with hook closure in the back. Material:85% polyamide, 15% elastane.;75B/S| 80B/M| 85B/L;Lady Lingerie Sets;http://s1.postimg.org/4rjhv86un/SET_FEMININE_39_90.jpg
"SET ""KITTEN""";€28,90;;Set includes a suspender + thong + and nipple covers.  ;S-L;Lady Lingerie Sets;http://s1.postimg.org/atr4lpvan/SET_KITTEN_28_90.jpg
"SET ""LILY""";€26,90;;Sheer black lace with glossy purple satin fabrics is a just  wo good reasons to make this kinky lingerie a part of your intimate wardrobe. The 1/4 cup bra is underwired, has adjustable straps and a hook closure in the back. The panties give you full playing freedom with a front-to-back entry. Material: 90% polyamide, 10% elastane. ;75B/S| 80B/M| 85B/L;Lady Lingerie Sets;http://s1.postimg.org/nc7q2asa7/SET_LILY_26_90.jpg
"SET ""PEEPHOLE""";€16,90;;"Seductive bikini made of soft transparent power net fabric.  Soft bra wit peepholes and halterneck strap. Comes with matching crotchless briefs.Color: Black. 100% polyamide.
";S/M|L/XL;Lady Lingerie Sets;http://s1.postimg.org/vf5wdmcvj/SET_PEEPHOLE_16_90.jpg
"SET ""ROSE""";€24,90;;Underwired bra with slightly padded cups and adjustable straps.  Hook closure in the back. The included matching panties are crotchless. Material: 88% polyamide, 12% elastane. NB! Sold without stockings.;75B/S ;Lady Lingerie Sets;http://s1.postimg.org/co3z3gib3/SET_ROSE_24_90.jpg
"SET ""TAIGA""";€29,90;;The underwired 1/4 bra has slightly padded cups, adjustable straps and hook-and-eye closure back.  The suspender belt has adjustable straps. With matching open crotch lace thong. Black/multi-coloured. Bra & suspender belt: 95% polyamide, 5% elastane. Thong: 100% polyamide.;75B/S| 80B/M| 85B/L;Lady Lingerie Sets;http://s1.postimg.org/osj8kfv73/SET_TAIGA_29_90.jpg
SET WITH FANTASTIC SHINY JEWELERY, BLACK;€29,90;;Extremely sexy and provocative set ! bra uncover breast, suspender belt and string. This exclusive Set is made of beauty full material with exclusive lace . Delivered like all our products in glossy bordo gift box. ;ONE;Lady Lingerie Sets;http://s1.postimg.org/4b2vmj8hb/SET_WITH_FANTASTIC_SHINY_JEWELERY_BLACK_29_90.jpg
SET WITH FANTASTIC SHINY JEWELERY, RED;€29,90;;Extremely sexy and provocative set ! bra uncover breast, suspender belt and string. This exclusive Set is made of beauty full material with exclusive lace . Delivered like all our products in glossy bordo gift box. ;S/M ;Lady Lingerie Sets;http://s1.postimg.org/6gx6h1bxr/SET_WITH_FANTASTIC_SHINY_JEWELERY_RED_29_90.jpg
SET WITH SKIRT;€41,90;;This set makes you look very sexy end hot. Feel like heroine in a Japanese story and unleash your wild side ... Black sexy corset and skirt makes a mysterious sensual connection, which no man can resist! ;S|M ;Lady Lingerie Sets;http://s1.postimg.org/jmcon55tb/SET_WITH_SKIRT_41_90.jpg
SEXY BIKINI;€29,90;€25,90;Sexy polka dotted bikini. ;S ;Lady Lingerie Sets;http://s1.postimg.org/d9xjdb2r3/SEXY_BIKINI_29_90.jpg
SEXY BLACK TOP + SKIRT SET;€23,90;;SEXY TOP + SKIRT SET. Color: black. ;ONE;Lady Lingerie Sets;http://s1.postimg.org/rvok1jzjj/SEXY_BLACK_TOP_SKIRT_SET_23_90.jpg
SEXY BRA WITH MINI SKIRT;€22,90;€9,99;Sexy bra with mini skirt. ;S-L;Lady Lingerie Sets;http://s1.postimg.org/43f8q0xin/SEXY_BRA_WITH_MINI_SKIRT_22_90.jpg
SEXY HONEY LINGERIE;€23,90;;Sexy honey lingerie includes babydoll, gloves and matching g-string. Remember that wearing sexy honey lingerie is not only about turning someone else on, it is about feeling great bout yourself too! Material : Acrylic+ Lace. Color Red.;ONE;Lady Lingerie Sets;http://s1.postimg.org/7029qb3cf/SEXY_HONEY_LINGERIE_23_90.jpg
SEXY HOT PURPLE HALTER BIKINI SET;€9,99;;Sexy hot halter bikini set . Color: purple. ;ONE;Lady Lingerie Sets;http://s1.postimg.org/ehbh5isvj/SEXY_HOT_PURPLE_HALTER_BIKINI_SET_9_99.jpg
SEXY LEATHER BIKINI SET;€29,90;;Sexy Leather Bikini Set. Button style. Color: black.;ONE;Lady Lingerie Sets;http://s1.postimg.org/c19nroasv/SEXY_LEATHER_BIKINI_SET_29_90.jpg
SEXY MAID COSTUME;€29,90;;Sweetheart Sexy Maid Costume of dear-lover includes hair band, matched collar, flirting cap sleeves top with contrast ruffled trim and lace-up back, tutu petticoat. Feather duster not included but you can shop independent from us. Material: 100% Polyester;M|L;Lady Lingerie Sets;http://s1.postimg.org/4drcn41in/SEXY_MAID_COSTUME_29_90.jpg
SEXY SCHOOLGIRL UNIFORM SET;€19,99;;"Sexy Schoolgirl Uniform Set includes: - Grid top, - Grid skirt
. Made of high quality cozy to wear material.";ONE;Lady Lingerie Sets;http://s1.postimg.org/4p8szvhyn/SEXY_SCHOOLGIRL_UNIFORM_SET_19_90.jpg
SEXY SET , BLACK;€24,90;;Bra, Skirt, String ;S/M|L/XL;Lady Lingerie Sets;http://s1.postimg.org/b0e0gaj73/SEXY_SET_3_PCS_26_90.jpg
SEXY SET, 3 PCS;€26,90;;This fiery set will warm up any atmosphere to a tropical temperature!  The set consists of 3 parts - satin bra with push-up cups with sequins covered straps and decorated with a bow, strings and flirty mini-skirt made of soft mesh, decorated with bow and sequins on a elastic band.;S/M;Lady Lingerie Sets;http://s1.postimg.org/n3jc3uu9b/SEXY_SET_BLACK_24_90.jpg
SKIRT+CORSET;€59,90;;Beautiful skirt&corset set. ;M|XL;Lady Lingerie Sets;http://s1.postimg.org/429wacl2n/SKIRT_CORSET_59_90.jpg
STRETCH LACE GARTER LINGERIE SET;€12,90;;Sexy Stretch lace garter lingerie set. NB! Stockings not included. Material: Polyester, Spandex. Color: black;ONE;Lady Lingerie Sets;http://s1.postimg.org/xipicrrfz/STRETCH_LACE_GARTER_LINGERIE_SET_12_90.jpg
SWEET SENORITA SET, XXXL;€42,90;;- Top (adjustable straps, mesh panels, a ruffled hem and detachable garters) . - G-strings. ;XXXL;Lady Lingerie Sets;http://s1.postimg.org/oc77phm7j/SWEET_SENORITA_SET_XXXL_42_90.jpg
TEMPTATION CHEMISE AND THONG SET;€24,90;;Lace chemise with lightly padded, underwired cups, ruffled mesh hem, removable garters and thong. Fabric :Acrylic+Spandex. Stockings not included.;ONE;Lady Lingerie Sets;http://s1.postimg.org/4vmi2yr3j/TEMPTATION_CHEMISE_AND_THONG_SET_24_90.jpg
TOP JA SEELIKU KOMPLEKT;€55,90;€17,90;Top ja seeliku komplekt. Näita oma naiselikku poolt! Poolpikkade varrukatega ja kuldse mustriga top ja seelik. Materjal: 90% polüamiid, 10% spandeks.;M|L;Lady Lingerie Sets;http://s1.postimg.org/cqx1hs0q7/TOP_JA_SEELIKU_KOMPLEKT_55_90.jpg
VANITY VAMP SET XXL/XXXL, RED;€36,90;;Vamp it up in the bedroom! The naughty set has a lace halter bra with satin bow detailing. The very short mesh skirt with ruffled trim and lace waist band is sure to tease your lover's senses. Matching mesh G-string included. - Bra, - Skirt, - G-strings. Color: red. Material: 90% polyamide 10% elasthan. ;XXL/XXXL;Lady Lingerie Sets;http://s1.postimg.org/ap15h9s4v/VANITY_VAMP_SET_XXL_XXXL_RED_36_90.jpg
VIKTORIA BRA BLACK/RED;€19,90;€12,00;Viktoria structured triangle bra has an elasticated single hook & eye back fastening. Halterneck style can be adjusted around the neck by a buckle for the perfect fit.  ;L ;Lady Lingerie Sets;http://s1.postimg.org/ph19uv8of/VIKTORIA_BRA_BLACK_RED_19_90.jpg
WELL CARE LEATHER NURSE LINGERIE;€25,90;;3 Piece Sexy Nurse Costume includes Halter Zipper Front Dress. Material: PVC;M|L|XL;Lady Lingerie Sets;http://s1.postimg.org/3kjc88kvj/WELL_CARE_LEATHER_NURSE_LINGERIE_25_90.jpg
WETLOOK TOP + STRING;€19,90;;Wetlook top + string.  Material: 90% polyester, 10% elastane. Color: black;L/XL;Lady Lingerie Sets;http://s1.postimg.org/9paulkcz3/WETLOOK_TOP_STRING_19_90.jpg
WETLOOK VEST AND SKIRT SET;€23,90;;Wow them in wetlook when you strut your stuff in this daring, biker babe inspired, two-piece skirt set featuring a halter-style crop top that ties around the neck, plunging open neckline with tri grommet trimmed lace-up front bodice and matching pleated, ruffle micro mini skirt with built-in mesh underlay and lowrise waistband. Material : 93% Polyester,7% Elastan;S-L;Lady Lingerie Sets;http://s1.postimg.org/6txrep8z3/WETLOOK_VEST_AND_SKIRT_SET_23_90.jpg
WHITE OPEN CUPS BRA LACE LINGERIE SET;€12,90;;"Strike the balance between flirtatious and outrageous. Lace balconet shape under wire cupless bra with bow & bling details, adjustable shoulder straps, fasten by the hook n eye closure on back. The g-string is also adjustable for a perfect fit you want.  Features
•Smooth soft lace created, this bra set is sure to make you sexy and snug
•Enjoy the kind of being cherish feeling in this sexy lingerie
•Sexy lingerie to reduce, discard the outfit and fetch it out instead
•Precious lace makes this bra set more bewitching and dissolute";ONE;Lady Lingerie Sets;http://s1.postimg.org/4rxa0gazz/WHITE_OPEN_CUPS_BRA_LACE_LINGERIE_SET_12_90.jpg
